{"block":0,"interpolation_patch_sha256":"2bc33d3d4f6163ba5af8982f1272e9544154ed95bc6155a4ee215c4e425c85b3","producer":{"all_required_samples_certified":true,"all_stationary_queries_resolved":true,"precision_bits":128,"worker_sha256":"73daaaf3d3130c75cc7a3014052cb4397a62ffd8ef3dc65086bbdf6502ba8c1d","worker_size_bytes":6279416},"required_sign_packet_sha256":"88f4d5a9305125cb185899d1fb000d8d68b0a098b38e0f9a7a87d63916a47f4d","schema":"sparkinterval.tg.platt-pt21-fused-source-trace.v1","semantic_status":{"analytic_turing_realization_proved":false,"hardy_z_endpoint_realization_proved":false,"main_multiplicity_realization_proved":false},"stationary_resolutions":[{"lower_offset":{"denominator":1,"numerator":0},"lower_value":{"hi":{"denominator":649037107316853453566312041152512,"numerator":1947111321950560360698936660328449},"lo":{"denominator":649037107316853453566312041152512,"numerator":1947111321950560360698935586586623}},"midpoint_offset":{"denominator":2,"numerator":1},"midpoint_value":{"hi":{"denominator":21267647932558653966460912964485513216,"numerator":-211126674625668227014518518770005570931},"lo":{"denominator":21267647932558653966460912964485513216,"numerator":-211126674625668227014518599865702544755}},"outer_left_sample":0,"outer_right_sample":2,"stream":"main","upper_offset":{"denominator":1,"numerator":1},"upper_value":{"hi":{"denominator":649037107316853453566312041152512,"numerator":649037107316853453566312578023425},"lo":{"denominator":649037107316853453566312041152512,"numerator":649037107316853453566311504281599}}},{"lower_offset":{"denominator":1,"numerator":10},"lower_value":{"hi":{"denominator":649037107316853453566312041152512,"numerator":1947111321950560360698936660328449},"lo":{"denominator":649037107316853453566312041152512,"numerator":1947111321950560360698935586586623}},"midpoint_offset":{"denominator":2,"numerator":21},"midpoint_value":{"hi":{"denominator":10633823966279326983230456482242756608,"numerator":-89461354723060415173531664682040491117},"lo":{"denominator":10633823966279326983230456482242756608,"numerator":-89461354723060415173531705229888978029}},"outer_left_sample":10,"outer_right_sample":12,"stream":"main","upper_offset":{"denominator":1,"numerator":11},"upper_value":{"hi":{"denominator":649037107316853453566312041152512,"numerator":649037107316853453566312578023425},"lo":{"denominator":649037107316853453566312041152512,"numerator":649037107316853453566311504281599}}}],"turing_inputs":{"lower":{"im_gamma_integral":{"hi":{"denominator":1152921504606846976,"numerator":2582467952078921320163046411263},"lo":{"denominator":1152921504606846976,"numerator":2582467952078921320161432321121}},"log_pi":{"hi":{"denominator":85070591730234615865843651857942052864,"numerator":97382848760492398273272072446497772135},"lo":{"denominator":85070591730234615865843651857942052864,"numerator":97382848760492398273272072446497772133}},"pi":{"hi":{"denominator":42535295865117307932921825928971026432,"numerator":133628573008120843482460046645233847913},"lo":{"denominator":5316911983139663491615228241121378304,"numerator":16703571626015105435307505830654230989}},"s_bound":{"hi":{"denominator":85070591730234615865843651857942052864,"numerator":291411456164825203348486254589124710331},"lo":{"denominator":85070591730234615865843651857942052864,"numerator":291411456164825203348486254589124710323}}},"upper":{"im_gamma_integral":{"hi":{"denominator":576460752303423488,"numerator":1291234115135807453254550386997},"lo":{"denominator":576460752303423488,"numerator":1291234115135807453253743342009}},"log_pi":{"hi":{"denominator":85070591730234615865843651857942052864,"numerator":97382848760492398273272072446497772135},"lo":{"denominator":85070591730234615865843651857942052864,"numerator":97382848760492398273272072446497772133}},"pi":{"hi":{"denominator":42535295865117307932921825928971026432,"numerator":133628573008120843482460046645233847913},"lo":{"denominator":5316911983139663491615228241121378304,"numerator":16703571626015105435307505830654230989}},"s_bound":{"hi":{"denominator":85070591730234615865843651857942052864,"numerator":291411456681297246229427480465943883815},"lo":{"denominator":85070591730234615865843651857942052864,"numerator":291411456681297246229427480465943883807}}}},"upstream_commit":"42b21426718e542daa2b006dc05ea2d7f26426e6"}
